{
  "vector_id": "v05-d1-pass-budget-allow-quota",
  "domain": "D1",
  "expected_topline": "PASS",
  "expected_reason_code": null,
  "ruleset_ref": "ruleset-1.2",
  "protocol_pin": "2025-draft",
  "schema_version": "1.0.0",
  "description": "Budget allow with quota tracking",
  "hash_scope": [
    "pack/trace/events.ndjson"
  ]
}