{
  "vector_id": "v05-d2-pass-terminal-cancelled",
  "domain": "D2",
  "expected_topline": "PASS",
  "expected_reason_code": null,
  "ruleset_ref": "ruleset-1.2",
  "protocol_pin": "2025-draft",
  "schema_version": "1.0.0",
  "description": "Clean terminal state: cancelled",
  "hash_scope": [
    "pack/trace/events.ndjson"
  ]
}